{
  "schema_version": "1.2",
  "correlation_id": "26c66baf-f646-4c8d-bac5-e9e27ab32b12",
  "step_id": "resolve-checkout-dendermonde-plc-2",
  "status": "completed",
  "summary": "The requested read-only targeted checkout completed.",
  "output_artifacts": [
    {
      "ref": "\\RWZI's\\100026 - Dendermonde\\100026 - Dendermonde, PLC02_CE",
      "kind": "octoplant-targeted-checkout",
      "local_path": "C:\\workspaces\\ot-engineer\\PLC-projecten\\Dendermonde - 100026\\RWZI's\\100026 - Dendermonde\\100026 - Dendermonde, PLC02_CE"
    }
  ],
  "octoplant_checkout": {
    "checkout_executed": true,
    "resolved_identity": {
      "installation_name": "Dendermonde",
      "installation_folder": "100026 - Dendermonde",
      "plc_name": "PLC 2",
      "project_folder": "100026 - Dendermonde, PLC02_CE"
    },
    "component_path": "\\RWZI's\\100026 - Dendermonde\\100026 - Dendermonde, PLC02_CE",
    "local_checkout_ref": "\\RWZI's\\100026 - Dendermonde\\100026 - Dendermonde, PLC02_CE",
    "source_version": null
  },
  "evidence": [
    {
      "captured_at": "2026-09-09T09:45:54Z",
      "type": "octoplant_resolution",
      "resolved_identity": {
        "installation_name": "Dendermonde",
        "installation_folder": "100026 - Dendermonde",
        "plc_name": "PLC 2",
        "project_folder": "100026 - Dendermonde, PLC02_CE"
      },
      "component_path": "\\RWZI's\\100026 - Dendermonde\\100026 - Dendermonde, PLC02_CE"
    },
    {
      "captured_at": "2026-09-09T09:45:54Z",
      "type": "octoplant_checkout_completed",
      "component_path": "\\RWZI's\\100026 - Dendermonde\\100026 - Dendermonde, PLC02_CE",
      "local_path": "C:\\workspaces\\ot-engineer\\PLC-projecten\\Dendermonde - 100026\\RWZI's\\100026 - Dendermonde\\100026 - Dendermonde, PLC02_CE"
    },
    {
      "captured_at": "2026-09-09T09:45:54Z",
      "type": "octoplant_unchanged_release_completed",
      "component_path": "\\RWZI's\\100026 - Dendermonde\\100026 - Dendermonde, PLC02_CE"
    }
  ],
  "risks": [
    {
      "code": "octoplant-local-checkout",
      "description": "Checkout content was copied to a local workspace; no shared archive was modified."
    }
  ]
}
